Title;Adress;Description;Cost;Phase;Blogpost URL;Databases;Company / Owner
Zotero plugin: Tag;https://github.com/windingwind/zotero-tag;Automate and expand Zotero's tag functions, for example automatically add a red marker to unread items;Free;Reference Management;https://utsmok.github.io/posts/zotero/;;
Zotero plugin: Zutilo;https://github.com/wshanks/Zutilo;Add some extra functionality to copy/paste, relations, tags, and more;Free;Reference Management;https://utsmok.github.io/posts/zotero/;;
Zotero plugin: Memento;https://github.com/leonkt/zotero-memento;Automatically archives the current version of the cited website in long-term archives like archive.org, so you never lose access to the original source;Free;Reference Management;https://utsmok.github.io/posts/zotero/;;
Zotero plugin: PDF preview;https://github.com/windingwind/zotero-pdf-preview;Adds a  .pdf preview when selecting an entry;Free;Reference Management;https://utsmok.github.io/posts/zotero/;;
Zotero plugin: citation counts;https://github.com/eschnett/zotero-citationcounts;Grabs citation counts for each entry by using crossref and others;Free;Reference Management;https://utsmok.github.io/posts/zotero/;;
Zotero plugin: shortDOI;https://github.com/bwiernik/zotero-shortdoi;Quickly acquire and/or clean-up DOI's.;Free;Reference Management;https://utsmok.github.io/posts/zotero/;;
Zotero plugin: inciteful.xyz;https://github.com/inciteful-xyz/inciteful-zotero-plugin;Quickly load up selected papers into inciteful;Free;Reference Management;https://utsmok.github.io/posts/zotero/, https://utsmok.github.io/posts/inciteful/;;
Zotero plugin: scite_;https://github.com/scitedotai/scite-zotero-plugin;Automatically grab citation info from scite_ ;Free;Reference Management;https://utsmok.github.io/posts/zotero/;;
Zotero plugin: format metadata;https://github.com/northword/zotero-format-metadata;Fix metadata easily with this collection of small tools;Free;Reference Management;https://utsmok.github.io/posts/zotero/;;
Zotero plugin: Word citation improvements;https://github.com/MuiseDestiny/zotero-citation;Smoother integration with Word (Plugin info is in Chinese);Free;Reference Management;https://utsmok.github.io/posts/zotero/;;
Zotero plugin: Style;https://github.com/MuiseDestiny/zotero-style;More options to change the main Zotero display & columns;Free;Reference Management;https://utsmok.github.io/posts/zotero/;;
Zotero plugin: Better notes;https://github.com/windingwind/zotero-better-notes;Complete overhaul of Zotero's note functionality;Free;Reference Management;https://utsmok.github.io/posts/zotero/;;
Bibcitation;https://www.bibcitation.com/;An fully web-based reference manager, also includes a browser plugin;Free;Reference Management;;;
